[
  {
    "id": "ikmf-world-part1-2026",
    "title": "IKMF World Championship 2026 Part 1",
    "startDate": "2026-05-22",
    "endDate": "2026-05-24",
    "country": "US",
    "city": "",
    "organizer": "IKMF",
    "federations": [
      "IKMF"
    ],
    "format": "in-person",
    "status": "confirmed",
    "disciplines": [],
    "registrationUrl": null,
    "registrationDeadline": null,
    "organizerUrl": null,
    "timeZone": null,
    "lastChecked": "2026-10-09T16:50:00Z",
    "sequence": 0,
    "sources": [
      {
        "organization": "IKMF",
        "url": "https://www.ikmf-world.com/calendars/ikmf-international-competitions/",
        "checkedAt": "2026-10-09T16:50:00Z"
      }
    ]
  },
  {
    "id": "ikmf-world-part2-2026",
    "title": "IKMF World Championship 2026 Part 2",
    "startDate": "2026-11-13",
    "endDate": "2026-11-15",
    "country": "GB",
    "city": "",
    "organizer": "IKMF",
    "federations": [
      "IKMF"
    ],
    "format": "in-person",
    "status": "confirmed",
    "disciplines": [],
    "registrationUrl": null,
    "registrationDeadline": null,
    "organizerUrl": null,
    "timeZone": "Europe/London",
    "lastChecked": "2026-10-09T15:00:00Z",
    "sequence": 0,
    "sources": [
      {
        "organization": "IKMF",
        "url": "https://www.ikmf-world.com/calendars/ikmf-international-competitions/",
        "checkedAt": "2026-10-09T15:00:00Z"
      }
    ]
  },
  {
    "id": "ikmf-world-part1-2027",
    "title": "IKMF World Championship 2027 Part 1",
    "startDate": "2027-05-07",
    "endDate": "2027-05-09",
    "country": "RS",
    "city": "",
    "organizer": "IKMF",
    "federations": [
      "IKMF"
    ],
    "format": "in-person",
    "status": "confirmed",
    "disciplines": [],
    "registrationUrl": null,
    "registrationDeadline": null,
    "organizerUrl": null,
    "timeZone": "Europe/Belgrade",
    "lastChecked": "2026-10-09T16:50:00Z",
    "sequence": 0,
    "sources": [
      {
        "organization": "IKMF",
        "url": "https://www.ikmf-world.com/calendars/ikmf-international-competitions/",
        "checkedAt": "2026-10-09T16:50:00Z"
      }
    ]
  }
]
