[
  {
    "id": "wksf-european-2026",
    "title": "WKSF European Open Championship 2026",
    "startDate": "2026-12-03",
    "endDate": "2026-12-06",
    "country": "IT",
    "city": "Turbigo",
    "organizer": "WKSF",
    "federations": [
      "WKSF"
    ],
    "format": "in-person",
    "status": "confirmed",
    "disciplines": [],
    "registrationUrl": null,
    "registrationDeadline": null,
    "organizerUrl": null,
    "timeZone": "Europe/Rome",
    "lastChecked": "2026-10-09T15:00:00Z",
    "sequence": 0,
    "sources": [
      {
        "organization": "WKSF",
        "url": "https://wksf.site/2026-informations/",
        "checkedAt": "2026-10-09T15:00:00Z"
      },
      {
        "organization": "WKSF",
        "url": "https://wksf.site/wp-content/uploads/2026/08/BROCHURE-EUROPEAN-CHAMPIONSHIP-2026-ITALY.pdf",
        "checkedAt": "2026-10-09T15:00:00Z"
      }
    ]
  }
]
